<?xml version="1.0" encoding="UTF-8"?>
<!DOCTYPE orders SYSTEM "orders.dtd">
<orders xmlns:xsi="http://www.w3.org/2001/XMLSchema-instance"
        xsi:noNamespaceSchemaLocation="donhang.xsd">
    <order id="0001">
        <product id="P001">
            <name>Điện thoại iPhone 14</name>
            <quantity>2</quantity>
        </product>
        <product id="P002">
            <name>Laptop Dell</name>
            <quantity>1</quantity>
        </product>
    </order>

    <order id="0002">
        <product id="P003">
            <name>Tai nghe Bluetooth</name>
            <quantity>3</quantity>
        </product>
        <product id="P004">
            <name>Chuột Logitech</name>
            <quantity>2</quantity>
        </product>
    </order>
</orders>
